{
  "formatId": "journal-submission.ieee",
  "phaseId": "journal-submission",
  "sourcePlatform": "IEEE",
  "addedBy": "u_arun_kapoor",
  "addedAt": "2026-03-02T09:00:00.000Z",
  "status": "active",
  "notes": "Small justified body type, all-caps level-1 headings, bracketed numeric citations. Structurally the furthest from the protocol template of any published format, which is why it is used in the golden tests as the second half of the style-independence check.",
  "sectionOrder": [
    "title-block",
    "abstract",
    "index-terms",
    "introduction",
    "methods",
    "results",
    "discussion",
    "conclusion",
    "acknowledgment",
    "references"
  ],
  "requiredBlocks": [
    "abstract",
    "index-terms",
    "references"
  ],
  "fallback": {
    "unknownBlockKind": "renderAsPlainParagraph"
  },
  "entitlement": {
    "tier": "paid"
  },
  "provenance": {
    "authoredBy": "u_arun_kapoor",
    "reviewedBy": "u_dami_adeyemi",
    "addedAt": "2026-03-02T09:00:00.000Z",
    "extractionAssisted": false
  }
}
