{
  "formatId": "data-processing.log-default",
  "phaseId": "data-processing",
  "sourcePlatform": "Internal — research platform default",
  "addedBy": "u_dami_adeyemi",
  "addedAt": "2026-02-12T15:00:00.000Z",
  "status": "active",
  "notes": "Audit-oriented layout for the data-processing phase: every cleaning step and exclusion is a numbered entry with the code that produced it.",
  "sectionOrder": [
    "dataset-summary",
    "cleaning-steps",
    "transformations",
    "exclusions",
    "derived-variables",
    "quality-checks",
    "audit-notes"
  ],
  "requiredBlocks": [
    "dataset-summary",
    "cleaning-steps"
  ],
  "fallback": {
    "unknownBlockKind": "renderAsPlainParagraph"
  },
  "entitlement": {
    "tier": "free"
  },
  "provenance": {
    "authoredBy": "u_dami_adeyemi",
    "reviewedBy": "u_marta_oliveira",
    "addedAt": "2026-02-12T15:00:00.000Z",
    "extractionAssisted": false
  }
}
