{
  "formatId": "journal-submission.plos-one",
  "phaseId": "journal-submission",
  "sourcePlatform": "PLOS",
  "addedBy": "u_dami_adeyemi",
  "addedAt": "2026-03-11T16:05:00.000Z",
  "status": "active",
  "notes": "PLOS requires a data-availability statement at submission, so it is in requiredBlocks and is supplied by the shared labelled-value block plugin.",
  "sectionOrder": [
    "title-page",
    "abstract",
    "introduction",
    "materials-and-methods",
    "results",
    "discussion",
    "supporting-information",
    "acknowledgments",
    "references"
  ],
  "requiredBlocks": [
    "abstract",
    "data-availability",
    "references"
  ],
  "fallback": {
    "unknownBlockKind": "renderAsPlainParagraph"
  },
  "entitlement": {
    "tier": "paid"
  },
  "provenance": {
    "authoredBy": "u_dami_adeyemi",
    "reviewedBy": "u_arun_kapoor",
    "addedAt": "2026-03-11T16:05:00.000Z",
    "extractionAssisted": false
  }
}
