{
  "formatId": "report-writing.consort",
  "phaseId": "report-writing",
  "sourcePlatform": "CONSORT Group",
  "addedBy": "u_arun_kapoor",
  "addedAt": "2026-01-14T09:20:00.000Z",
  "status": "active",
  "notes": "Authored from the CONSORT 2010 statement and the accompanying checklist. Structural extraction was run against the official checklist .docx to surface its real style names; all semantic mapping (sectionOrder, requiredBlocks, styleMap) was written by hand and reviewed.",
  "sectionOrder": [
    "title-page",
    "abstract",
    "introduction",
    "methods",
    "results",
    "discussion",
    "consort-flow-diagram",
    "consort-checklist",
    "references"
  ],
  "requiredBlocks": [
    "consort-flow-diagram",
    "trial-registration-number"
  ],
  "numbering": {
    "checklistItem": {
      "scheme": "consort-item-number",
      "source": "attrs.checklistNo",
      "prefix": "Item ",
      "suffix": ". "
    }
  },
  "fallback": {
    "unknownBlockKind": "renderAsPlainParagraph"
  },
  "entitlement": {
    "tier": "paid"
  },
  "provenance": {
    "authoredBy": "u_arun_kapoor",
    "reviewedBy": "u_marta_oliveira",
    "addedAt": "2026-01-14T09:20:00.000Z",
    "extractionAssisted": true
  }
}
