{
  "formatId": "data-collection.crf-redcap",
  "phaseId": "data-collection",
  "sourcePlatform": "REDCap",
  "addedBy": "u_dami_adeyemi",
  "addedAt": "2026-02-10T08:30:00.000Z",
  "status": "active",
  "notes": "A printable CRF laid out to match REDCap's data-entry form order. No TOC and no cover page — a CRF is a working document, not a report.",
  "sectionOrder": [
    "form-header",
    "eligibility",
    "demographics",
    "medical-history",
    "visit-data",
    "adverse-events",
    "completion"
  ],
  "requiredBlocks": [
    "form-header",
    "eligibility"
  ],
  "numbering": {
    "custom:crfField": {
      "scheme": "crf-field-number",
      "source": "attrs.fieldNumber",
      "suffix": ") "
    }
  },
  "fallback": {
    "unknownBlockKind": "renderAsPlainParagraph"
  },
  "entitlement": {
    "tier": "free"
  },
  "provenance": {
    "authoredBy": "u_dami_adeyemi",
    "reviewedBy": "u_arun_kapoor",
    "addedAt": "2026-02-10T08:30:00.000Z",
    "extractionAssisted": false
  }
}
