{
  "formatId": "stat-analysis.default",
  "phaseId": "stat-analysis",
  "sourcePlatform": "Internal — research platform default",
  "addedBy": "u_marta_oliveira",
  "addedAt": "2026-02-17T13:45:00.000Z",
  "status": "active",
  "notes": "Uses the shared statResultTable block plugin. Table numbering is read from attrs.tableNumber so tables keep the numbers used in the analysis plan. Citation style is author-year here, which is the first format to exercise a non-numeric citation style.",
  "sectionOrder": [
    "analysis-summary",
    "study-population",
    "primary-outcome",
    "secondary-outcomes",
    "subgroup-analyses",
    "sensitivity-analyses",
    "missing-data",
    "analysis-code"
  ],
  "requiredBlocks": [
    "analysis-summary",
    "primary-outcome"
  ],
  "numbering": {
    "table": {
      "scheme": "table-number",
      "source": "attrs.tableNumber",
      "prefix": "Table ",
      "suffix": ". "
    }
  },
  "fallback": {
    "unknownBlockKind": "renderAsPlainParagraph"
  },
  "entitlement": {
    "tier": "free"
  },
  "provenance": {
    "authoredBy": "u_marta_oliveira",
    "reviewedBy": "u_dami_adeyemi",
    "addedAt": "2026-02-17T13:45:00.000Z",
    "extractionAssisted": false
  }
}
